<?xml version="1.0" encoding="UTF-8" standalone="no"?>
<!DOCTYPE workflowMonitor SYSTEM "wfInfo.dtd">
<workflowMonitor>
   <workflow name="RedazioneArticolo">
      <action automaticallyIstantiated="false" name="Pubblicazione" role="Redattore">
         <simpleAction/>
      </action>
      <action automaticallyIstantiated="false" name="Revisione" role="Giornalista">
         <simpleAction possibleNextActions="Controllo"/>
      </action>
      <action automaticallyIstantiated="true" name="Scrittura" role="Giornalista">
         <simpleAction possibleNextActions="Controllo"/>
      </action>
      <action automaticallyIstantiated="false" name="Controllo" role="Redattore">
         <simpleAction possibleNextActions="Revisione Pubblicazione"/>
      </action>
      <process startTime="15/01/2008 19:26 CET">
         <actionStatus action="Scrittura" terminationTime="15/01/2008 20:53 CET">
            <actor name="Francesca Rossi" role="Giornalista"/>
         </actionStatus>
         <actionStatus action="Controllo" terminationTime="17/01/2008 12:17 CET">
            <actor name="Enrico Maria Rossi" role="Redattore"/>
         </actionStatus>
         <actionStatus action="Pubblicazione" terminationTime="18/01/2008 17:45 CET">
            <actor name="Enrico Maria Rossi" role="Redattore"/>
         </actionStatus>
      </process>
      <process startTime="05/02/2008 15:18 CET">
         <actionStatus action="Scrittura"/>
      </process>
      <process startTime="18/01/2008 00:10 CET">
         <actionStatus action="Scrittura" terminationTime="18/01/2008 05:28 CET">
            <actor name="Giovanni Gonzales" role="Giornalista"/>
         </actionStatus>
         <actionStatus action="Controllo" terminationTime="19/01/2008 06:48 CET">
            <actor name="Enrico Maria Rossi" role="Redattore"/>
         </actionStatus>
         <actionStatus action="Pubblicazione" terminationTime="20/01/2008 16:19 CET">
            <actor name="Mario Fumagalli" role="Redattore"/>
         </actionStatus>
      </process>
      <process startTime="26/01/2008 06:35 CET">
         <actionStatus action="Scrittura" terminationTime="28/01/2008 03:18 CET">
            <actor name="Giuseppe Castiglia" role="Giornalista"/>
         </actionStatus>
         <actionStatus action="Controllo" terminationTime="28/01/2008 17:57 CET">
            <actor name="Enrico Maria Rossi" role="Redattore"/>
         </actionStatus>
         <actionStatus action="Pubblicazione" terminationTime="29/01/2008 13:43 CET">
            <actor name="Mario Del Santo" role="Redattore"/>
         </actionStatus>
      </process>
      <process startTime="17/01/2008 05:56 CET">
         <actionStatus action="Scrittura"/>
      </process>
   </workflow>
   <workflow name="VenditaNormale">
      <action automaticallyIstantiated="true" name="ConsegnaMerce" role="Magazziniere">
         <simpleAction/>
      </action>
      <action automaticallyIstantiated="true" name="EmissFattura" role="Contabile">
         <simpleAction possibleNextActions="RicezPagamento"/>
      </action>
      <action automaticallyIstantiated="false" name="RicezPagamento" role="Contabile">
         <simpleAction/>
      </action>
      <process startTime="15/01/2008 13:17 CET">
         <actionStatus action="ConsegnaMerce" terminationTime="16/01/2008 11:44 CET">
            <actor name="Enrica Neri" role="Magazziniere"/>
         </actionStatus>
         <actionStatus action="EmissFattura" terminationTime="18/01/2008 11:33 CET">
            <actor name="Carol Vicentini" role="Contabile"/>
         </actionStatus>
         <actionStatus action="RicezPagamento" terminationTime="18/01/2008 21:06 CET">
            <actor name="Carol Vicentini" role="Contabile"/>
         </actionStatus>
      </process>
      <process startTime="08/02/2008 16:34 CET">
         <actionStatus action="ConsegnaMerce" terminationTime="09/02/2008 12:22 CET">
            <actor name="Sonia Silvestri" role="Magazziniere"/>
         </actionStatus>
         <actionStatus action="EmissFattura" terminationTime="10/02/2008 18:59 CET">
            <actor name="Andrea Lanfranco" role="Contabile"/>
         </actionStatus>
         <actionStatus action="RicezPagamento" terminationTime="11/02/2008 02:43 CET">
            <actor name="Andrea Lanfranco" role="Contabile"/>
         </actionStatus>
      </process>
      <process startTime="14/01/2008 13:15 CET">
         <actionStatus action="ConsegnaMerce"/>
         <actionStatus action="EmissFattura"/>
      </process>
      <process startTime="09/02/2008 21:22 CET">
         <actionStatus action="ConsegnaMerce" terminationTime="12/02/2008 17:51 CET">
            <actor name="Enrica Neri" role="Magazziniere"/>
         </actionStatus>
         <actionStatus action="EmissFattura" terminationTime="11/02/2008 20:29 CET">
            <actor name="Carol Vicentini" role="Contabile"/>
         </actionStatus>
         <actionStatus action="RicezPagamento"/>
      </process>
      <process startTime="12/01/2008 18:36 CET">
         <actionStatus action="ConsegnaMerce" terminationTime="13/01/2008 08:38 CET">
            <actor name="Claude Prisco" role="Magazziniere"/>
         </actionStatus>
         <actionStatus action="EmissFattura">
            <actor name="Carol Vicentini" role="Contabile"/>
         </actionStatus>
      </process>
   </workflow>
   <workflow name="GestioneVendita">
      <action automaticallyIstantiated="false" name="VenditaNormale" role="RespVendite">
         <processAction actionWorkflow="VenditaNormale"/>
      </action>
      <action automaticallyIstantiated="true" name="AccettazOrdine" role="AddettoVendite">
         <simpleAction possibleNextActions="VenditaPagAnt VenditaNormale"/>
      </action>
      <action automaticallyIstantiated="false" name="VenditaPagAnt" role="RespVendite">
         <processAction actionWorkflow="VenditaPagAnt"/>
      </action>
      <process startTime="02/02/2008 19:56 CET">
         <actionStatus action="AccettazOrdine" terminationTime="04/02/2008 00:07 CET">
            <actor name="Giovanni Francese" role="AddettoVendite"/>
         </actionStatus>
         <actionStatus action="VenditaNormale" terminationTime="05/02/2008 07:49 CET">
            <actor name="Mauro Perissino" role="RespVendite"/>
         </actionStatus>
      </process>
      <process startTime="30/01/2008 10:31 CET">
         <actionStatus action="AccettazOrdine" terminationTime="01/02/2008 03:13 CET">
            <actor name="Riccardo Bianchi" role="AddettoVendite"/>
         </actionStatus>
         <actionStatus action="VenditaNormale" terminationTime="01/02/2008 22:23 CET">
            <actor name="Pippo Silvestri" role="RespVendite"/>
         </actionStatus>
      </process>
      <process startTime="14/01/2008 20:50 CET">
         <actionStatus action="AccettazOrdine" terminationTime="16/01/2008 13:49 CET">
            <actor name="Riccardo Bianchi" role="AddettoVendite"/>
         </actionStatus>
         <actionStatus action="VenditaPagAnt" terminationTime="18/01/2008 04:04 CET">
            <actor name="Mario De Vitis" role="RespVendite"/>
         </actionStatus>
      </process>
   </workflow>
   <workflow name="VenditaPagAnt">
      <action automaticallyIstantiated="false" name="ConsegnaMerce" role="Magazziniere">
         <simpleAction/>
      </action>
      <action automaticallyIstantiated="false" name="RicezPagamento" role="Contabile">
         <simpleAction possibleNextActions="ConsegnaMerce"/>
      </action>
      <action automaticallyIstantiated="true" name="EmissFattura" role="Contabile">
         <simpleAction possibleNextActions="RicezPagamento"/>
      </action>
      <process startTime="28/01/2008 00:11 CET">
         <actionStatus action="EmissFattura" terminationTime="29/01/2008 05:34 CET">
            <actor name="Francesco Messina" role="Contabile"/>
         </actionStatus>
         <actionStatus action="RicezPagamento" terminationTime="29/01/2008 06:52 CET">
            <actor name="Mario Lamarmora" role="Contabile"/>
         </actionStatus>
         <actionStatus action="ConsegnaMerce" terminationTime="31/01/2008 05:58 CET">
            <actor name="Carol Del Santo" role="Magazziniere"/>
         </actionStatus>
      </process>
      <process startTime="22/01/2008 16:59 CET">
         <actionStatus action="EmissFattura"/>
      </process>
      <process startTime="20/01/2008 15:06 CET">
         <actionStatus action="EmissFattura" terminationTime="22/01/2008 15:57 CET">
            <actor name="Francesco Messina" role="Contabile"/>
         </actionStatus>
         <actionStatus action="RicezPagamento">
            <actor name="Mario Lamarmora" role="Contabile"/>
         </actionStatus>
      </process>
   </workflow>
</workflowMonitor>
