<?xml version="1.0" encoding="UTF-8" standalone="no"?>
<!DOCTYPE workflowMonitor SYSTEM "wfInfo.dtd">
<workflowMonitor>
   <workflow name="RedazioneArticolo">
      <action automaticallyIstantiated="false" name="Revisione" role="Giornalista">
         <simpleAction possibleNextActions="Controllo"/>
      </action>
      <action automaticallyIstantiated="false" name="Controllo" role="Redattore">
         <simpleAction possibleNextActions="Revisione Pubblicazione"/>
      </action>
      <action automaticallyIstantiated="false" name="Pubblicazione" role="Redattore">
         <simpleAction/>
      </action>
      <action automaticallyIstantiated="true" name="Scrittura" role="Giornalista">
         <simpleAction possibleNextActions="Controllo"/>
      </action>
   </workflow>
   <workflow name="VenditaNormale">
      <action automaticallyIstantiated="true" name="EmissFattura" role="Contabile">
         <simpleAction possibleNextActions="RicezPagamento"/>
      </action>
      <action automaticallyIstantiated="false" name="RicezPagamento" role="Contabile">
         <simpleAction/>
      </action>
      <action automaticallyIstantiated="true" name="ConsegnaMerce" role="Magazziniere">
         <simpleAction/>
      </action>
      <process startTime="15/01/2008 19:26 CET">
         <actionStatus action="ConsegnaMerce" terminationTime="15/01/2008 20:19 CET">
            <actor name="Matteo Laviola" role="Magazziniere"/>
         </actionStatus>
         <actionStatus action="EmissFattura" terminationTime="15/01/2008 20:05 CET">
            <actor name="Giovanni Milanesi" role="Contabile"/>
         </actionStatus>
         <actionStatus action="RicezPagamento" terminationTime="16/01/2008 18:02 CET">
            <actor name="Monica Perla" role="Contabile"/>
         </actionStatus>
      </process>
      <process startTime="14/01/2008 06:29 CET">
         <actionStatus action="ConsegnaMerce" terminationTime="14/01/2008 16:04 CET">
            <actor name="Maurizio Baldo" role="Magazziniere"/>
         </actionStatus>
         <actionStatus action="EmissFattura" terminationTime="15/01/2008 06:55 CET">
            <actor name="Monica Perla" role="Contabile"/>
         </actionStatus>
         <actionStatus action="RicezPagamento" terminationTime="16/01/2008 18:38 CET">
            <actor name="Claudio Castiglia" role="Contabile"/>
         </actionStatus>
      </process>
   </workflow>
   <workflow name="GestioneVendita">
      <action automaticallyIstantiated="true" name="AccettazOrdine" role="AddettoVendite">
         <simpleAction possibleNextActions="VenditaPagAnt VenditaNormale"/>
      </action>
      <action automaticallyIstantiated="false" name="VenditaPagAnt" role="RespVendite">
         <processAction actionWorkflow="VenditaPagAnt"/>
      </action>
      <action automaticallyIstantiated="false" name="VenditaNormale" role="RespVendite">
         <processAction actionWorkflow="VenditaNormale"/>
      </action>
      <process startTime="12/01/2008 20:52 CET">
         <actionStatus action="AccettazOrdine" terminationTime="14/01/2008 13:51 CET">
            <actor name="Maurizio Gonzales" role="AddettoVendite"/>
         </actionStatus>
         <actionStatus action="VenditaNormale" terminationTime="15/01/2008 22:59 CET">
            <actor name="Claude Francese" role="RespVendite"/>
         </actionStatus>
      </process>
   </workflow>
   <workflow name="VenditaPagAnt">
      <action automaticallyIstantiated="true" name="EmissFattura" role="Contabile">
         <simpleAction possibleNextActions="RicezPagamento"/>
      </action>
      <action automaticallyIstantiated="false" name="ConsegnaMerce" role="Magazziniere">
         <simpleAction/>
      </action>
      <action automaticallyIstantiated="false" name="RicezPagamento" role="Contabile">
         <simpleAction possibleNextActions="ConsegnaMerce"/>
      </action>
   </workflow>
</workflowMonitor>
