<?xml version="1.0" encoding="UTF-8" standalone="no"?>
<!DOCTYPE workflowMonitor SYSTEM "wfInfo.dtd">
<workflowMonitor>
   <workflow name="RedazioneArticolo">
      <action automaticallyIstantiated="false" name="Pubblicazione" role="Redattore">
         <simpleAction/>
      </action>
      <action automaticallyIstantiated="false" name="Controllo" role="Redattore">
         <simpleAction possibleNextActions="Revisione Pubblicazione"/>
      </action>
      <action automaticallyIstantiated="true" name="Scrittura" role="Giornalista">
         <simpleAction possibleNextActions="Controllo"/>
      </action>
      <action automaticallyIstantiated="false" name="Revisione" role="Giornalista">
         <simpleAction possibleNextActions="Controllo"/>
      </action>
      <process startTime="12/01/2008 01:32 CET">
         <actionStatus action="Scrittura" terminationTime="13/01/2008 13:04 CET">
            <actor name="Giuseppe Elkan" role="Giornalista"/>
         </actionStatus>
         <actionStatus action="Controllo" terminationTime="13/01/2008 13:31 CET">
            <actor name="Giuseppe Vicentini" role="Redattore"/>
         </actionStatus>
         <actionStatus action="Pubblicazione" terminationTime="14/01/2008 12:34 CET">
            <actor name="Monica Vicentini" role="Redattore"/>
         </actionStatus>
      </process>
      <process startTime="19/01/2008 03:23 CET">
         <actionStatus action="Scrittura" terminationTime="20/01/2008 01:14 CET">
            <actor name="Giuseppe Elkan" role="Giornalista"/>
         </actionStatus>
         <actionStatus action="Controllo" terminationTime="21/01/2008 09:28 CET">
            <actor name="Giuseppe Vicentini" role="Redattore"/>
         </actionStatus>
         <actionStatus action="Pubblicazione" terminationTime="23/01/2008 06:30 CET">
            <actor name="Carlo Marini" role="Redattore"/>
         </actionStatus>
      </process>
   </workflow>
   <workflow name="VenditaNormale">
      <action automaticallyIstantiated="true" name="EmissFattura" role="Contabile">
         <simpleAction possibleNextActions="RicezPagamento"/>
      </action>
      <action automaticallyIstantiated="false" name="RicezPagamento" role="Contabile">
         <simpleAction/>
      </action>
      <action automaticallyIstantiated="true" name="ConsegnaMerce" role="Magazziniere">
         <simpleAction/>
      </action>
      <process startTime="15/01/2008 18:28 CET">
         <actionStatus action="ConsegnaMerce" terminationTime="16/01/2008 07:22 CET">
            <actor name="Clara Cadorna" role="Magazziniere"/>
         </actionStatus>
         <actionStatus action="EmissFattura">
            <actor name="Claudio Minzoni" role="Contabile"/>
         </actionStatus>
      </process>
      <process startTime="13/01/2008 12:52 CET">
         <actionStatus action="ConsegnaMerce"/>
         <actionStatus action="EmissFattura"/>
      </process>
      <process startTime="15/01/2008 08:43 CET">
         <actionStatus action="ConsegnaMerce">
            <actor name="Clara Cadorna" role="Magazziniere"/>
         </actionStatus>
         <actionStatus action="EmissFattura"/>
      </process>
   </workflow>
   <workflow name="GestioneVendita">
      <action automaticallyIstantiated="false" name="VenditaPagAnt" role="RespVendite">
         <processAction actionWorkflow="VenditaPagAnt"/>
      </action>
      <action automaticallyIstantiated="false" name="VenditaNormale" role="RespVendite">
         <processAction actionWorkflow="VenditaNormale"/>
      </action>
      <action automaticallyIstantiated="true" name="AccettazOrdine" role="AddettoVendite">
         <simpleAction possibleNextActions="VenditaPagAnt VenditaNormale"/>
      </action>
      <process startTime="21/01/2008 22:37 CET">
         <actionStatus action="AccettazOrdine" terminationTime="22/01/2008 12:26 CET">
            <actor name="Enrica Lascarpa" role="AddettoVendite"/>
         </actionStatus>
         <actionStatus action="VenditaNormale" terminationTime="23/01/2008 13:40 CET">
            <actor name="Carol Aziz" role="RespVendite"/>
         </actionStatus>
      </process>
   </workflow>
   <workflow name="VenditaPagAnt">
      <action automaticallyIstantiated="true" name="EmissFattura" role="Contabile">
         <simpleAction possibleNextActions="RicezPagamento"/>
      </action>
      <action automaticallyIstantiated="false" name="ConsegnaMerce" role="Magazziniere">
         <simpleAction/>
      </action>
      <action automaticallyIstantiated="false" name="RicezPagamento" role="Contabile">
         <simpleAction possibleNextActions="ConsegnaMerce"/>
      </action>
   </workflow>
</workflowMonitor>
