<?xml version="1.0" encoding="UTF-8" standalone="no"?>
<!DOCTYPE workflowMonitor SYSTEM "wfInfo.dtd">
<workflowMonitor>
<workflow name="RedazioneArticolo">
<action automaticallyIstantiated="false" name="Pubblicazione" role="Redattore">
<simpleAction/>
</action>
<action automaticallyIstantiated="false" name="Revisione" role="Giornalista">
<simpleAction possibleNextActions="Controllo"/>
</action>
<action automaticallyIstantiated="true" name="Scrittura" role="Giornalista">
<simpleAction possibleNextActions="Controllo"/>
</action>
<action automaticallyIstantiated="false" name="Controllo" role="Redattore">
<simpleAction possibleNextActions="Revisione Pubblicazione"/>
</action>
<process startTime="12/01/2008 00:58 CET">
<actionStatus action="Scrittura" actor="Anreina Vicentini" terminationTime="12/01/2008 17:15 CET"/>
<actionStatus action="Controllo" actor="Paolo Gonzales" terminationTime="12/01/2008 21:16 CET"/>
<actionStatus action="Pubblicazione" actor="Paolo Gonzales"/>
</process>
<process startTime="18/01/2008 14:21 CET">
<actionStatus action="Scrittura" actor="Anreina Vicentini"/>
</process>
<process startTime="21/01/2008 05:24 CET">
<actionStatus action="Scrittura" actor="Clara Baldo" terminationTime="22/01/2008 17:51 CET"/>
<actionStatus action="Controllo" actor="Maurizio Baldo" terminationTime="24/01/2008 01:32 CET"/>
<actionStatus action="Pubblicazione" actor="Maurizio Baldo" terminationTime="24/01/2008 19:21 CET"/>
</process>
<process startTime="17/01/2008 12:56 CET">
<actionStatus action="Scrittura" actor="Clara Baldo" terminationTime="18/01/2008 14:06 CET"/>
<actionStatus action="Controllo" actor="Francesca Neri" terminationTime="19/01/2008 07:26 CET"/>
<actionStatus action="Revisione" actor="Anreina Vicentini" terminationTime="20/01/2008 11:55 CET"/>
<actionStatus action="Controllo"/>
</process>
<process startTime="14/01/2008 19:11 CET">
<actionStatus action="Scrittura" actor="Anreina Vicentini" terminationTime="16/01/2008 02:24 CET"/>
<actionStatus action="Controllo" actor="Maurizio Baldo" terminationTime="17/01/2008 02:06 CET"/>
<actionStatus action="Revisione" actor="Clara Baldo" terminationTime="17/01/2008 22:13 CET"/>
<actionStatus action="Controllo" actor="Francesca Neri" terminationTime="18/01/2008 15:18 CET"/>
<actionStatus action="Pubblicazione"/>
</process>
<process startTime="23/01/2008 21:53 CET">
<actionStatus action="Scrittura" actor="Elisabeth Carpenteri" terminationTime="25/01/2008 02:16 CET"/>
<actionStatus action="Controllo" actor="Paolo Gonzales" terminationTime="25/01/2008 10:44 CET"/>
<actionStatus action="Revisione" actor="Elisabeth Carpenteri" terminationTime="26/01/2008 14:00 CET"/>
<actionStatus action="Controllo" actor="Maurizio Baldo"/>
</process>
</workflow>
<workflow name="VenditaNormale">
<action automaticallyIstantiated="false" name="RicezPagamento" role="Contabile">
<simpleAction/>
</action>
<action automaticallyIstantiated="true" name="EmissFattura" role="Contabile">
<simpleAction possibleNextActions="RicezPagamento"/>
</action>
<action automaticallyIstantiated="true" name="ConsegnaMerce" role="Magazziniere">
<simpleAction/>
</action>
<process startTime="22/01/2008 17:10 CET">
<actionStatus action="ConsegnaMerce" actor="Enrico Maria Marini"/>
<actionStatus action="EmissFattura" actor="Mario Lagiostra" terminationTime="22/01/2008 19:51 CET"/>
<actionStatus action="RicezPagamento" actor="Caio Baresi"/>
</process>
<process startTime="26/01/2008 23:45 CET">
<actionStatus action="ConsegnaMerce" actor="Sonia Fumagalli" terminationTime="30/01/2008 10:58 CET"/>
<actionStatus action="EmissFattura" actor="Mario Lagiostra" terminationTime="28/01/2008 22:41 CET"/>
<actionStatus action="RicezPagamento" actor="Mario Lagiostra" terminationTime="30/01/2008 04:18 CET"/>
</process>
<process startTime="20/01/2008 22:24 CET">
<actionStatus action="ConsegnaMerce" actor="Sonia Fumagalli"/>
<actionStatus action="EmissFattura" actor="Matteo Tasca" terminationTime="21/01/2008 03:26 CET"/>
<actionStatus action="RicezPagamento"/>
</process>
</workflow>
<workflow name="GestioneVendita">
<action automaticallyIstantiated="false" name="VenditaPagAnt" role="RespVendite">
<processAction actionWorkflow="VenditaPagAnt"/>
</action>
<action automaticallyIstantiated="true" name="AccettazOrdine" role="AddettoVendite">
<simpleAction possibleNextActions="VenditaPagAnt VenditaNormale"/>
</action>
<action automaticallyIstantiated="false" name="VenditaNormale" role="RespVendite">
<processAction actionWorkflow="VenditaNormale"/>
</action>
<process startTime="28/01/2008 08:56 CET">
<actionStatus action="AccettazOrdine" actor="Matteo Messina" terminationTime="28/01/2008 09:34 CET"/>
<actionStatus action="VenditaNormale" actor="Maurizio Carcieri" terminationTime="29/01/2008 06:32 CET"/>
</process>
<process startTime="27/01/2008 07:38 CET">
<actionStatus action="AccettazOrdine"/>
</process>
</workflow>
<workflow name="VenditaPagAnt">
<action automaticallyIstantiated="false" name="ConsegnaMerce" role="Magazziniere">
<simpleAction/>
</action>
<action automaticallyIstantiated="true" name="EmissFattura" role="Contabile">
<simpleAction possibleNextActions="RicezPagamento"/>
</action>
<action automaticallyIstantiated="false" name="RicezPagamento" role="Contabile">
<simpleAction possibleNextActions="ConsegnaMerce"/>
</action>
</workflow>
<actor name="Anreina Vicentini" role="Giornalista"/>
<actor name="Paolo Gonzales" role="Redattore"/>
<actor name="Clara Baldo" role="Giornalista"/>
<actor name="Maurizio Baldo" role="Redattore"/>
<actor name="Francesca Neri" role="Redattore"/>
<actor name="Elisabeth Carpenteri" role="Giornalista"/>
<actor name="Enrico Maria Marini" role="Magazziniere"/>
<actor name="Mario Lagiostra" role="Contabile"/>
<actor name="Caio Baresi" role="Contabile"/>
<actor name="Sonia Fumagalli" role="Magazziniere"/>
<actor name="Matteo Tasca" role="Contabile"/>
<actor name="Matteo Messina" role="AddettoVendite"/>
<actor name="Maurizio Carcieri" role="RespVendite"/>
</workflowMonitor>
